{"profile": "houseatlas.ifc-source-revision.v1", "scope": {"workspaceId": "896b0f96-8f55-5890-9e51-954d0680a1bf", "homeId": "cc968fad-c0f5-5711-ae08-1c120bc4f2cc", "buildingId": "9086a723-d091-5a7c-8903-eb4901bde79c"}, "sourceId": "95c7ea94-5c11-5c4f-b426-938b0d7c529e", "revisionId": "e41d204f-2b26-5c70-9e7f-a16511afacbe", "parentRevisionId": null, "ifcAsset": {"assetId": "fde17941-df57-5f5e-8472-235ab40d1f89", "sha256": "9a4ca161d677bc48598073db90e38ecb58402e709b71f540e4d4b842c9694ef9", "bytes": 1720}, "authoringTool": {"name": "synthetic", "version": "1"}, "declaredUnits": "mm", "declaredUpAxis": "Z", "semanticMapRevisionId": "9ab52f61-0b33-5ebe-90d1-e62f5bedb44a", "semanticMapSha256": "1db823ed85997e2830544f30699a764cd0503a3cfaa38a622d86cd104a1146f1"}