{"profile": "houseatlas.ifc-source-revision.v1", "scope": {"workspaceId": "eda986dc-80fc-584c-9350-ebcc4bd5d599", "homeId": "5ac4b592-ed7c-5a17-a503-0eedb2477bb1", "buildingId": "ed098a05-48ae-5253-a1b8-214d4b82c8d6"}, "sourceId": "3ce351a6-1cbc-5727-a179-37eb848a009a", "revisionId": "e6987fc9-4f98-59e2-a9da-ea5849ca687a", "parentRevisionId": null, "ifcAsset": {"assetId": "20543711-7aee-5f41-9de9-4fc31ca5c9c0", "sha256": "fdb561137f395460d78ff43b0b9f0e034932f42656396caf88095a514690c768", "bytes": 1882}, "authoringTool": {"name": "synthetic", "version": "1"}, "declaredUnits": "mm", "declaredUpAxis": "Z", "semanticMapRevisionId": "453cf63c-67a3-5abb-9cf3-ea19b0726538", "semanticMapSha256": "40e6393d43ac433a6c1e81d50f5db6ca90aaa95ac9a58c81132819d53fdf622d"}